{
  "@context": [
    "https://www.w3.org/ns/credentials/v2",
    "https://fe-lixe.github.io/meaningful-participation/1.0/context/mpp.jsonld"
  ],
  "id": "urn:uuid:c3a1e7d2-4b9f-4e60-a5d8-2f71b06c9e43",
  "type": [
    "VerifiableCredential",
    "ParticipationCredential"
  ],
  "issuer": "https://journal.example.org/identifiers/editorial-system",
  "validFrom": "2026-07-28T13:22:14Z",
  "credentialSubject": {
    "id": "https://orcid.org/0000-0002-1825-0097",
    "participationRecord": {
      "type": "ParticipationRecord",
      "mppVersion": "1.0",
      "id": "urn:uuid:77bf495d-f8ca-4661-9ed2-5b2c499607de",
      "ecosystem": "urn:mpp:ecosystem:01JQ4C6AQ9H9H30C27Y4HPRT52",
      "participants": [
        {
          "id": "https://orcid.org/0000-0002-1825-0097",
          "roles": [
            "subject",
            "https://journal.example.org/mpp/roles/reviewer"
          ]
        },
        {
          "id": "https://journal.example.org/identifiers/editorial-system",
          "roles": [
            "asserter"
          ]
        }
      ],
      "participationType": "https://example.org/mpp/participation-types/peer-review",
      "participationDescription": "Completed a substantive review of a submitted research paper.",
      "commitmentClasses": [
        "effort",
        "knowledge",
        "standing"
      ],
      "meaningProfile": "https://example.org/mpp/meaning-profiles/verified-peer-review/v1",
      "participationStart": "2026-07-14",
      "participationEnd": "2026-07-28T13:15:00Z",
      "recordCreationTimestamp": "2026-07-28T13:22:14Z",
      "evidence": [
        "urn:uuid:8d5c4515-8985-41f3-9061-78f7d0e280ad"
      ],
      "context": {
        "submissionId": "submission-48372",
        "journal": "Journal of Example Research",
        "reviewRound": 2
      },
      "privacy": {
        "recordVisibility": "public"
      }
    }
  },
  "credentialStatus": {
    "id": "https://journal.example.org/status/3#94567",
    "type": "BitstringStatusListEntry",
    "statusPurpose": "revocation",
    "statusListIndex": "94567",
    "statusListCredential": "https://journal.example.org/status/3"
  },
  "proof": {
    "type": "DataIntegrityProof",
    "cryptosuite": "eddsa-rdfc-2022",
    "created": "2026-07-28T13:22:14Z",
    "verificationMethod": "https://journal.example.org/identifiers/editorial-system#key-1",
    "proofPurpose": "assertionMethod",
    "proofValue": "z..."
  }
}
